{
  "generated_at": "2026-04-26T21:30:00Z",
  "schema_version": "1.0.0",
  "artifact": "COMMAND_OUTPUT_ROI_RECEIPT",
  "receipt_id": "command-output-roi-pass-001",
  "source_benchmark": {
    "tactic_id": "command_output_roi",
    "promotion_scope": "fleet-portable",
    "evidence_ref": "BMA retained report: research/reports/provider-neutral-tier3-live-paired-benchmark-2026-04-26.md"
  },
  "owner_surface": {
    "repo": "repo-upgrade-advisor",
    "runtime_surface": "scripts/score-operation.sh",
    "mode": "bounded_single_session_output_dir"
  },
  "governed_artifacts": [
    {
      "path": "OPPORTUNITIES.md",
      "artifact_class": "human_report",
      "scanned": true
    },
    {
      "path": "OPPORTUNITIES.json",
      "artifact_class": "machine_summary",
      "scanned": true
    }
  ],
  "allowed_raw_receipt_artifacts": [
    "advisor-stdout.txt",
    "*.jsonl",
    "*RECEIPT*.md"
  ],
  "verdict": "pass",
  "raw_transcript_detected": false,
  "violations": [],
  "policy": {
    "summary_required": true,
    "raw_logs_allowed_in": [
      "receipt artifacts",
      "stdout/stderr logs",
      "raw jsonl transcripts"
    ],
    "direct_metric_claim": false,
    "cache_claim": false
  },
  "bounded_non_claims": [
    "This receipt does not prove cache savings.",
    "This receipt does not promote provider-scoped prompt/context tactics.",
    "This receipt does not authorize target-repo mutation."
  ]
}
